Topic/Question,Answer,Category 1,Category 2,Age of Baby,Link 1,Link 2,Link 3,Link 4,Link 5
Is it normal for breast or vaginal discharge in the baby?,"Yes! Vaginal discharge occurs in the first few weeks in many newborn females, and breast swelling and discharge can occur in both genders. Vaginal discharge may be clear or cloudy and sticky (like Vaseline), or yellow or even green. There is normally no therapy or testing needed for most girls. Breast swelling occurs with most babies in the first weeks after discharge, and the breast tissue may grow to the size of a large grape. In babies with more swelling, clear to cloudy discharge may also occur.  Swelling and discharge resolve in the first month for most boys and may take several months to go away in girls. If this persists or worries you, talk it over with your doctor. 
",Diaper,Skin,0-3 months,,,,,
How do I know when my baby is too hot or too cold?,"You should have a thermometer which is age-appropriate for use on your baby. In the first few months, the temperature should be between 97 and 99.9.  If the temperature is too high or too low, call your doctor. If the temperature is above 100.4, take your baby to the emergency room.",Skin,,0-3 months,,,,,
Which medications are safe for my baby to have? And how do I think about dosing?,"In the first few months, most people have diaper rash creams and fever medicine (such as acetaminophen) on hand, but you should talk to your doctor before using any medication in a baby under 2 months old.",Medication,,0-3 months,,,,,
How can I tell if my baby’s length and/or weight are normal?,"This is what checkups are all about – making sure your baby is growing well!  Growth is influenced by birth weight, family member size, nutrition and medical conditions.  If you or your doctor are concerned about your baby’s growth, you should talk about this.
",Growth,,0-3 months,,,,,
How many layers of clothing does my infant need to go outside?,"As a rule of thumb, dress your baby in one more layer than you do! ",Clothing,,0-3 months,,,,,
How do I help my other child(ren) adjust to being older sibling(s)?,"Teach older children how to be around newborns. Demonstrate how to act around baby by your actions. Teach them soft touches and how to give baby a massage for example. Be careful with your words and provide alternate reasons rather than using “no!” Stay close and monitor interactions and be sure to give siblings a lot of praise. Be supportive, you may involve the older child in tasks and give siblings special time with you, provide extra love and support, as this is a big adjustment.",Behavior,Siblings,0-3 months,,,,,